{
  "slug": "anthropic-skills",
  "category": "cognition",
  "keywords": [
    "skill",
    "规范",
    "frontmatter",
    "description"
  ],
  "source": {
    "repo": "unknown",
    "ref": "unknown",
    "commit": "unknown",
    "extractedAt": "2026-02-18T03:35:30Z"
  },
  "slices": [
    {
      "file": "01-spec-template.md",
      "module": "spec-template",
      "keywords": [
        "skill",
        "规范",
        "frontmatter",
        "description"
      ],
      "sourcePath": "unknown"
    }
  ]
}
