{
  "slug": "anthropic-agent-bible",
  "category": "engineering",
  "keywords": [
    "agent",
    "patterns",
    "tools",
    "context",
    "harness",
    "multi-agent",
    "evals",
    "security",
    "best-practices"
  ],
  "source": {
    "repo": "anthropic-engineering-blog",
    "ref": "2024-12 ~ 2026-02",
    "commit": "15-articles",
    "extractedAt": "2026-02-19T12:00:00Z"
  },
  "slices": [
    {
      "file": "01-foundation.md",
      "module": "foundation",
      "keywords": ["patterns", "workflows", "agents", "SDK", "ACI"],
      "sourcePath": "anthropic.com/research/building-effective-agents"
    },
    {
      "file": "02-tool-mastery.md",
      "module": "tool-mastery",
      "keywords": ["tools", "think", "skills", "search", "programmatic"],
      "sourcePath": "anthropic.com/engineering/advanced-tool-use"
    },
    {
      "file": "03-context-engineering.md",
      "module": "context-engineering",
      "keywords": ["context", "rot", "JIT", "compaction", "RAG", "retrieval"],
      "sourcePath": "anthropic.com/engineering/effective-context-engineering"
    },
    {
      "file": "04-long-task-collaboration.md",
      "module": "long-task-collaboration",
      "keywords": ["harness", "multi-agent", "MCP", "code-execution", "progress"],
      "sourcePath": "anthropic.com/engineering/effective-harnesses"
    },
    {
      "file": "05-production-deployment.md",
      "module": "production-deployment",
      "keywords": ["evals", "pass-k", "sandbox", "security", "postmortem"],
      "sourcePath": "anthropic.com/engineering/demystifying-evals"
    }
  ]
}
